{
  "$schema": "https://json-schema.org/draft/2020-12/schema",
  "$id": "https://github.com/robertolocatelli81-dev/x402-signature-vectors/schema/vector.schema.json",
  "title": "x402 signature conformance vector",
  "description": "A self-contained EIP-712 signature conformance vector. Everything needed to reproduce the verdict is in the file, including the domain the x402 specification leaves unstated.",
  "type": "object",
  "required": [
    "id",
    "origin",
    "standard",
    "signer",
    "eip712",
    "signature",
    "expected",
    "notes"
  ],
  "additionalProperties": false,
  "properties": {
    "id": {
      "type": "string",
      "pattern": "^[0-9]{3}-[a-z0-9-]+$",
      "description": "Stable identifier, zero-padded ordinal plus slug. Never reused."
    },
    "origin": {
      "enum": [
        "spec",
        "generated"
      ],
      "description": "'spec' = payload and signature taken verbatim from the x402 specifications, expected verdict is the audit result. 'generated' = signed with the published test key. The two must never be conflated."
    },
    "standard": {
      "type": "string",
      "description": "The signing standard under test, e.g. 'EIP-3009 TransferWithAuthorization'."
    },
    "eip712": {
      "type": "object",
      "required": [
        "domain",
        "types",
        "primaryType",
        "message"
      ],
      "additionalProperties": false,
      "properties": {
        "domain": {
          "type": "object",
          "required": [
            "name",
            "chainId",
            "verifyingContract"
          ],
          "properties": {
            "name": {
              "type": "string"
            },
            "version": {
              "type": "string"
            },
            "chainId": {
              "type": "integer",
              "minimum": 0
            },
            "verifyingContract": {
              "type": "string",
              "pattern": "^0x[0-9a-fA-F]{40}$"
            }
          },
          "description": "EIP-712 domain. `version` is optional on purpose: EIP-712 allows partial domains and the canonical Permit2 contract omits it — an implementation that assumes four fixed fields computes a different separator."
        },
        "types": {
          "type": "object",
          "description": "EIP-712 type definitions, excluding EIP712Domain (implied by the domain object).",
          "additionalProperties": {
            "type": "array",
            "items": {
              "type": "object",
              "required": [
                "name",
                "type"
              ],
              "properties": {
                "name": {
                  "type": "string"
                },
                "type": {
                  "type": "string"
                }
              }
            }
          }
        },
        "primaryType": {
          "type": "string"
        },
        "message": {
          "type": "object"
        }
      }
    },
    "signature": {
      "type": "string",
      "pattern": "^0x[0-9a-fA-F]*$",
      "description": "Signature as transmitted. Length is NOT constrained here: a malformed length is exactly what some vectors test, and rejecting it is the verifier's job, not the schema's."
    },
    "expected": {
      "type": "object",
      "required": [
        "verdict",
        "recovered_address",
        "type_hash",
        "domain_separator",
        "hash_struct",
        "signing_digest"
      ],
      "additionalProperties": false,
      "properties": {
        "verdict": {
          "enum": [
            "accept",
            "reject"
          ],
          "description": "The verdict a conformant verifier MUST reach on the signature layer alone."
        },
        "recovered_address": {
          "type": [
            "string",
            "null"
          ],
          "pattern": "^0x[0-9a-fA-F]{40}$",
          "description": "Address the signature actually recovers to, or null when recovery is undefined (malformed signature, or rejected by a form check before recovery)."
        },
        "type_hash": {
          "type": [
            "string",
            "null"
          ],
          "pattern": "^0x[0-9a-fA-F]{64}$",
          "description": "keccak256(encodeType(primaryType)) — lets the encoding layer be tested in isolation from ECDSA. null when the message cannot be encoded at all (missing field, unknown primaryType)."
        },
        "domain_separator": {
          "type": [
            "string",
            "null"
          ],
          "pattern": "^0x[0-9a-fA-F]{64}$",
          "description": "hashStruct(EIP712Domain). null when the message cannot be encoded at all (missing field, unknown primaryType)."
        },
        "hash_struct": {
          "type": [
            "string",
            "null"
          ],
          "pattern": "^0x[0-9a-fA-F]{64}$",
          "description": "hashStruct(primaryType, message). null when the message cannot be encoded at all (missing field, unknown primaryType)."
        },
        "signing_digest": {
          "type": [
            "string",
            "null"
          ],
          "pattern": "^0x[0-9a-fA-F]{64}$",
          "description": "keccak256(0x1901 || domainSeparator || hashStruct): the bytes actually signed. null when the message cannot be encoded at all (missing field, unknown primaryType)."
        },
        "reject_reason": {
          "enum": [
            "signature_malformed",
            "signature_out_of_range",
            "signature_high_s",
            "encoding_error",
            "recovery_undefined",
            "signer_mismatch"
          ],
          "description": "REQUIRED when verdict is reject (enforced by tools/check_schema.py). The class of reason a conformant verifier rejects for. A verifier that rejects for a different reason is not conformant: rejecting for the wrong reason is how a broken test passes. Classes are defined in tools/reject_reasons.py."
        }
      }
    },
    "notes": {
      "type": "array",
      "items": {
        "type": "string"
      },
      "minItems": 1,
      "description": "Why the vector exists and what a failure on it means. A vector without a stated purpose is noise."
    },
    "signer": {
      "type": "string",
      "pattern": "^0x[0-9a-fA-F]{40}$",
      "description": "Address the message attributes as its signer. Declared, never inferred from field names: a struct may call it anything."
    }
  }
}
