{
  "id": "037-array-single",
  "origin": "generated",
  "standard": "EIP-712 encoding (array)",
  "signer": "0x9d8a62f656a8d1615c1294fd71e9cfb3e4855a4f",
  "eip712": {
    "domain": {
      "name": "USDC",
      "version": "2",
      "chainId": 84532,
      "verifyingContract": "0x036CbD53842c5426634e7929541eC2318f3dCF7e"
    },
    "types": {
      "Lista": [
        {
          "name": "chi",
          "type": "address"
        },
        {
          "name": "voci",
          "type": "Voce[]"
        }
      ],
      "Voce": [
        {
          "name": "sku",
          "type": "string"
        },
        {
          "name": "quantita",
          "type": "uint256"
        }
      ]
    },
    "primaryType": "Lista",
    "message": {
      "chi": "0x9d8a62f656a8d1615c1294fd71e9cfb3e4855a4f",
      "voci": [
        {
          "sku": "solo",
          "quantita": 1
        }
      ]
    }
  },
  "signature": "0xbb50e2d89a4ed70663d080659fe0ad4b9bc3e06c17a227433966cb59ceee020d5eed822bca82637973f1df9725b8d1e8d6e0895c4ba55423daefb997cac77c4b1c",
  "expected": {
    "verdict": "accept",
    "recovered_address": "0x9d8a62f656a8d1615c1294fd71e9cfb3e4855a4f",
    "type_hash": "0x5d1cc16c0bfdec498b8a2b402db5676240208df7e65cc33bb1831753366ca719",
    "domain_separator": "0x71f17a3b2ff373b803d70a5a07c046c1a2bc8e89c09ef722fcb047abe94c9818",
    "hash_struct": "0xe15119554225899e2251d4998c176be2fff04bbb511927cf17f7fa54ca096db1",
    "signing_digest": "0x9628866b1b3478319f24b7302cc6ff7d949c7ea828d813ec64cda5b35c2ad778"
  },
  "notes": [
    "array con un solo elemento.",
    "Un array vuoto produce keccak256(b''): le implementazioni che sollevano o saltano il campo calcolano un hashStruct diverso."
  ]
}
