{
  "id": "044-nonce-all-ff",
  "origin": "generated",
  "standard": "EIP-3009 TransferWithAuthorization",
  "signer": "0x9d8a62f656a8d1615c1294fd71e9cfb3e4855a4f",
  "eip712": {
    "domain": {
      "name": "USDC",
      "version": "2",
      "chainId": 84532,
      "verifyingContract": "0x036CbD53842c5426634e7929541eC2318f3dCF7e"
    },
    "types": {
      "TransferWithAuthorization": [
        {
          "name": "from",
          "type": "address"
        },
        {
          "name": "to",
          "type": "address"
        },
        {
          "name": "value",
          "type": "uint256"
        },
        {
          "name": "validAfter",
          "type": "uint256"
        },
        {
          "name": "validBefore",
          "type": "uint256"
        },
        {
          "name": "nonce",
          "type": "bytes32"
        }
      ]
    },
    "primaryType": "TransferWithAuthorization",
    "message": {
      "from": "0x9d8a62f656a8d1615c1294fd71e9cfb3e4855a4f",
      "to": "0x209693Bc6afc0C5328bA36FaF03C514EF312287C",
      "value": 10000,
      "validAfter": 1740672089,
      "validBefore": 1740672154,
      "nonce": "0xffffffffffffffffffffffffffffffffffffffffffffffffffffffffffffffff"
    }
  },
  "signature": "0xbb50e2d89a4ed70663d080659fe0ad4b9bc3e06c17a227433966cb59ceee020d071709740e5a3049775105751218f81907363e42ef6bb5d256640db009bab5cc1c",
  "expected": {
    "verdict": "accept",
    "recovered_address": "0x9d8a62f656a8d1615c1294fd71e9cfb3e4855a4f",
    "type_hash": "0x7c7c6cdb67a18743f49ec6fa9b35f50d52ed05cbed4cc592e13b44501c1a2267",
    "domain_separator": "0x71f17a3b2ff373b803d70a5a07c046c1a2bc8e89c09ef722fcb047abe94c9818",
    "hash_struct": "0x3509836784d1692e08673c8567b97b46c8d5129e4d087172c56b91405b0fd220",
    "signing_digest": "0xb3c1b4532aa6a5bc751a0ec89a95fcb9b6e1b0210da7e1f34c7ce1f6dff69327"
  },
  "notes": [
    "Confine del nonce EIP-3009: nonce tutto a FF.",
    "Il nonce e' un bytes32 opaco: nessun valore e' speciale per la firma. Rifiutarlo e' policy anti-replay, non verifica."
  ]
}
