{
  "id": "011-value-max-uint256",
  "origin": "generated",
  "standard": "EIP-3009 TransferWithAuthorization",
  "signer": "0x9d8a62f656a8d1615c1294fd71e9cfb3e4855a4f",
  "eip712": {
    "domain": {
      "name": "USDC",
      "version": "2",
      "chainId": 84532,
      "verifyingContract": "0x036CbD53842c5426634e7929541eC2318f3dCF7e"
    },
    "types": {
      "TransferWithAuthorization": [
        {
          "name": "from",
          "type": "address"
        },
        {
          "name": "to",
          "type": "address"
        },
        {
          "name": "value",
          "type": "uint256"
        },
        {
          "name": "validAfter",
          "type": "uint256"
        },
        {
          "name": "validBefore",
          "type": "uint256"
        },
        {
          "name": "nonce",
          "type": "bytes32"
        }
      ]
    },
    "primaryType": "TransferWithAuthorization",
    "message": {
      "from": "0x9d8a62f656a8d1615c1294fd71e9cfb3e4855a4f",
      "to": "0x209693Bc6afc0C5328bA36FaF03C514EF312287C",
      "value": 115792089237316195423570985008687907853269984665640564039457584007913129639935,
      "validAfter": 1740672089,
      "validBefore": 1740672154,
      "nonce": "0xf3746613c2d920b5fdabc0856f2aeb2d4f88ee6037b8cc5d04a71a4462f13480"
    }
  },
  "signature": "0xbb50e2d89a4ed70663d080659fe0ad4b9bc3e06c17a227433966cb59ceee020d682a9b5c3da11f9beb22cb307278f157268381797a1b934dbdc42bae8f3043801c",
  "expected": {
    "verdict": "accept",
    "recovered_address": "0x9d8a62f656a8d1615c1294fd71e9cfb3e4855a4f",
    "type_hash": "0x7c7c6cdb67a18743f49ec6fa9b35f50d52ed05cbed4cc592e13b44501c1a2267",
    "domain_separator": "0x71f17a3b2ff373b803d70a5a07c046c1a2bc8e89c09ef722fcb047abe94c9818",
    "hash_struct": "0xe79f04ea2115b761f114212bd7d67670f18e3c3dda09ddb58f341f8112147f92",
    "signing_digest": "0x6a969b51bd0040cb2a35411a999edfbfdbbea1bdd52ae6e1325dbac6a2d21fd1"
  },
  "notes": [
    "Bordo: importo al massimo rappresentabile. La FIRMA e' valida e deve verificare.",
    "MARCATORE DI CONFINE, non un test crittografico: serve a dimostrare che il livello firma NON deve applicare regole di business. Chi lo rifiuta sta mischiando i livelli.",
    "Il verdetto crittografico e' accept: rifiutarlo per ragioni di policy (importo nullo, finestra invertita) e' compito del livello sopra, e va tenuto distinto dalla firma."
  ]
}
