{
  "id": "072-bool-as-string-false",
  "origin": "generated",
  "standard": "EIP-712 encoding — strict JSON value forms",
  "signer": "0x9d8a62f656a8d1615c1294fd71e9cfb3e4855a4f",
  "eip712": {
    "domain": {
      "name": "USDC",
      "version": "2",
      "chainId": 84532,
      "verifyingContract": "0x036CbD53842c5426634e7929541eC2318f3dCF7e"
    },
    "types": {
      "Flag": [
        {
          "name": "attivo",
          "type": "bool"
        }
      ]
    },
    "primaryType": "Flag",
    "message": {
      "attivo": "false"
    }
  },
  "signature": "0xbb50e2d89a4ed70663d080659fe0ad4b9bc3e06c17a227433966cb59ceee020d677e30b75d2dffe1bcaf2f53542f56c7ccdd285e573796ced64a4fd87f52b4db1b",
  "expected": {
    "verdict": "reject",
    "recovered_address": null,
    "type_hash": null,
    "domain_separator": null,
    "hash_struct": null,
    "signing_digest": null,
    "reject_reason": "encoding_error"
  },
  "notes": [
    "`attivo` = \"false\" (stringa) per un bool: bool(\"false\") = true. Mostra false, firma true.",
    "Firma VERA della chiave di test sul messaggio che un parser permissivo ricava da questo JSON: un verificatore che normalizza il valore recupera il firmatario dichiarato e ACCETTA. Il JSON mostrato non e' il messaggio firmato: e' un differenziale di parsing, e la sola risposta sicura e' encoding_error."
  ]
}
