{
  "id": "029-v-raw-one",
  "origin": "generated",
  "standard": "EIP-3009 TransferWithAuthorization",
  "signer": "0x9d8a62f656a8d1615c1294fd71e9cfb3e4855a4f",
  "eip712": {
    "domain": {
      "name": "USDC",
      "version": "2",
      "chainId": 84532,
      "verifyingContract": "0x036CbD53842c5426634e7929541eC2318f3dCF7e"
    },
    "types": {
      "TransferWithAuthorization": [
        {
          "name": "from",
          "type": "address"
        },
        {
          "name": "to",
          "type": "address"
        },
        {
          "name": "value",
          "type": "uint256"
        },
        {
          "name": "validAfter",
          "type": "uint256"
        },
        {
          "name": "validBefore",
          "type": "uint256"
        },
        {
          "name": "nonce",
          "type": "bytes32"
        }
      ]
    },
    "primaryType": "TransferWithAuthorization",
    "message": {
      "from": "0x9d8a62f656a8d1615c1294fd71e9cfb3e4855a4f",
      "to": "0x209693Bc6afc0C5328bA36FaF03C514EF312287C",
      "value": 10000,
      "validAfter": 1740672089,
      "validBefore": 1740672154,
      "nonce": "0xf3746613c2d920b5fdabc0856f2aeb2d4f88ee6037b8cc5d04a71a4462f13480"
    }
  },
  "signature": "0xbb50e2d89a4ed70663d080659fe0ad4b9bc3e06c17a227433966cb59ceee020d12bdb8654363b6038c470a60dd5cc8ab93b0cb83e85021a62c2784f516455f2901",
  "expected": {
    "verdict": "reject",
    "recovered_address": null,
    "type_hash": "0x7c7c6cdb67a18743f49ec6fa9b35f50d52ed05cbed4cc592e13b44501c1a2267",
    "domain_separator": "0x71f17a3b2ff373b803d70a5a07c046c1a2bc8e89c09ef722fcb047abe94c9818",
    "hash_struct": "0x2d4485bc772d834706524f22dd4d659cdebef9a830534e35df3d0642cfdbee1b",
    "signing_digest": "0xd11f1fb6f95e521838858254326d198cfc84c37a192e789a5028d17c60d95574",
    "reject_reason": "signature_malformed"
  },
  "notes": [
    "v = 1 (recovery id grezzo, non 28).",
    "Ethereum trasmette v come 27/28. Accettare anche 0/1 senza dirlo rende la stessa autorizzazione valida in due forme: da decidere esplicitamente, non per caso."
  ]
}
