{
  "id": "041-permit2-witness-transfer",
  "origin": "generated",
  "standard": "Permit2 PermitWitnessTransferFrom (x402 assetTransferMethod=permit2)",
  "signer": "0x9d8a62f656a8d1615c1294fd71e9cfb3e4855a4f",
  "eip712": {
    "domain": {
      "name": "Permit2",
      "chainId": 84532,
      "verifyingContract": "0x000000000022D473030F116dDEE9F6B43aC78BA3"
    },
    "types": {
      "PermitWitnessTransferFrom": [
        {
          "name": "permitted",
          "type": "TokenPermissions"
        },
        {
          "name": "spender",
          "type": "address"
        },
        {
          "name": "nonce",
          "type": "uint256"
        },
        {
          "name": "deadline",
          "type": "uint256"
        },
        {
          "name": "witness",
          "type": "Witness"
        }
      ],
      "TokenPermissions": [
        {
          "name": "token",
          "type": "address"
        },
        {
          "name": "amount",
          "type": "uint256"
        }
      ],
      "Witness": [
        {
          "name": "to",
          "type": "address"
        },
        {
          "name": "validAfter",
          "type": "uint256"
        }
      ]
    },
    "primaryType": "PermitWitnessTransferFrom",
    "message": {
      "permitted": {
        "token": "0x036CbD53842c5426634e7929541eC2318f3dCF7e",
        "amount": 10000
      },
      "spender": "0x402085c248EeA27D92E8b30b2C58ed07f9E20001",
      "nonce": 33247007178036348590600198031289925668252061821958005840077069883511451257277,
      "deadline": 1740672154,
      "witness": {
        "to": "0x209693Bc6afc0C5328bA36FaF03C514EF312287C",
        "validAfter": 1740672089
      }
    }
  },
  "signature": "0xbb50e2d89a4ed70663d080659fe0ad4b9bc3e06c17a227433966cb59ceee020d1d27df4eb0baeb13b451a816af0ccece9cb698df84c55e0746c41cecc233b8231b",
  "expected": {
    "verdict": "accept",
    "recovered_address": "0x9d8a62f656a8d1615c1294fd71e9cfb3e4855a4f",
    "type_hash": "0xebc156cd23678a74c94df13d772ef5478420637f0c94bd10d509e1dc98f521c7",
    "domain_separator": "0x010f27a92fb9a32622f44f001dc4d15706a85b33499cfc2ce9033113ab26592c",
    "hash_struct": "0xf9efd2ab5ec37a11f062cfbde5dd2654b11aa7c03eedbac1f9bf0efd67b2d8b4",
    "signing_digest": "0x21528e1468aac114016416353e2309329f217dc180b21baa1d81cde941095685"
  },
  "notes": [
    "Il secondo metodo di trasferimento di x402, finora scoperto dalla suite.",
    "I tipi sono quelli della spec: WITNESS_TYPE_STRING dichiara Witness(address to,uint256 validAfter) e TokenPermissions(address token,uint256 amount).",
    "Il dominio e' quello del contratto Permit2 canonico e NON ha version: chi riusa il dominio del token qui calcola un separator sbagliato."
  ]
}
