{
  "id": "030-domain-chainid-zero",
  "origin": "generated",
  "standard": "EIP-3009 TransferWithAuthorization",
  "signer": "0x9d8a62f656a8d1615c1294fd71e9cfb3e4855a4f",
  "eip712": {
    "domain": {
      "name": "USDC",
      "version": "2",
      "chainId": 0,
      "verifyingContract": "0x036CbD53842c5426634e7929541eC2318f3dCF7e"
    },
    "types": {
      "TransferWithAuthorization": [
        {
          "name": "from",
          "type": "address"
        },
        {
          "name": "to",
          "type": "address"
        },
        {
          "name": "value",
          "type": "uint256"
        },
        {
          "name": "validAfter",
          "type": "uint256"
        },
        {
          "name": "validBefore",
          "type": "uint256"
        },
        {
          "name": "nonce",
          "type": "bytes32"
        }
      ]
    },
    "primaryType": "TransferWithAuthorization",
    "message": {
      "from": "0x9d8a62f656a8d1615c1294fd71e9cfb3e4855a4f",
      "to": "0x209693Bc6afc0C5328bA36FaF03C514EF312287C",
      "value": 10000,
      "validAfter": 1740672089,
      "validBefore": 1740672154,
      "nonce": "0xf3746613c2d920b5fdabc0856f2aeb2d4f88ee6037b8cc5d04a71a4462f13480"
    }
  },
  "signature": "0xbb50e2d89a4ed70663d080659fe0ad4b9bc3e06c17a227433966cb59ceee020d52d8a781b2f3fc6647443aa5574e920889f95901d06407dc3cfc095a622a0e681c",
  "expected": {
    "verdict": "accept",
    "recovered_address": "0x9d8a62f656a8d1615c1294fd71e9cfb3e4855a4f",
    "type_hash": "0x7c7c6cdb67a18743f49ec6fa9b35f50d52ed05cbed4cc592e13b44501c1a2267",
    "domain_separator": "0x276b37285105733c30bbd308046e9f95bc25867bf7aee2d84cc832daaa12b0eb",
    "hash_struct": "0x2d4485bc772d834706524f22dd4d659cdebef9a830534e35df3d0642cfdbee1b",
    "signing_digest": "0x6980f039872a76e7d53334c820d4314f4ef7b7770a9550beb3445dc163d27f24"
  },
  "notes": [
    "Dominio ai confini: chainId = 0.",
    "La firma e' valida: il domainSeparator cambia ma resta ben definito. Un'implementazione che tratta il valore come assente invece che come valore produce un separator diverso e fallisce."
  ]
}
