{
  "id": "007-mutated-valid-before",
  "origin": "generated",
  "standard": "EIP-3009 TransferWithAuthorization",
  "signer": "0x9d8a62f656a8d1615c1294fd71e9cfb3e4855a4f",
  "eip712": {
    "domain": {
      "name": "USDC",
      "version": "2",
      "chainId": 84532,
      "verifyingContract": "0x036CbD53842c5426634e7929541eC2318f3dCF7e"
    },
    "types": {
      "TransferWithAuthorization": [
        {
          "name": "from",
          "type": "address"
        },
        {
          "name": "to",
          "type": "address"
        },
        {
          "name": "value",
          "type": "uint256"
        },
        {
          "name": "validAfter",
          "type": "uint256"
        },
        {
          "name": "validBefore",
          "type": "uint256"
        },
        {
          "name": "nonce",
          "type": "bytes32"
        }
      ]
    },
    "primaryType": "TransferWithAuthorization",
    "message": {
      "from": "0x9d8a62f656a8d1615c1294fd71e9cfb3e4855a4f",
      "to": "0x209693Bc6afc0C5328bA36FaF03C514EF312287C",
      "value": 10000,
      "validAfter": 1740672089,
      "validBefore": 1740672155,
      "nonce": "0xf3746613c2d920b5fdabc0856f2aeb2d4f88ee6037b8cc5d04a71a4462f13480"
    }
  },
  "signature": "0xbb50e2d89a4ed70663d080659fe0ad4b9bc3e06c17a227433966cb59ceee020d12bdb8654363b6038c470a60dd5cc8ab93b0cb83e85021a62c2784f516455f291b",
  "expected": {
    "verdict": "reject",
    "recovered_address": "0x95b918796bbd17b1e5865807a22fd5fa64e7c278",
    "type_hash": "0x7c7c6cdb67a18743f49ec6fa9b35f50d52ed05cbed4cc592e13b44501c1a2267",
    "domain_separator": "0x71f17a3b2ff373b803d70a5a07c046c1a2bc8e89c09ef722fcb047abe94c9818",
    "hash_struct": "0x6522ac2c8170221fb3bb7b184134f596c42bdbf262b5dcce635396760606bd1f",
    "signing_digest": "0xf4b0904d407bd18a283cdb4f2e3af946d4bef9ffb8e0e5fdcbb3a147b280eab0"
  },
  "notes": [
    "Mutazione del vettore 003: finestra di validita' spostata di 1 secondo.",
    "La firma resta quella del 003: un verificatore che accetta questo vettore non sta legando la firma al messaggio."
  ]
}
